[
  {
    "spelling": "actor",
    "pos": "n.",
    "countability": "countable",
    "number_behavior": "regular",
    "default_number": "singular",
    "semantic_category": "person",
    "provenance": {
      "source": "curated_by_agent",
      "reviewed": true,
      "confidence": "high",
      "checked_at": "2026-07-30"
    }
  },
  {
    "spelling": "advice",
    "pos": "n.",
    "countability": "uncountable",
    "number_behavior": "mass",
    "default_number": "singular",
    "indefinite_article_override": "none",
    "verb_agreement": "singular",
    "semantic_category": "abstract",
    "provenance": {
      "source": "curated_by_agent",
      "reviewed": true,
      "confidence": "high",
      "checked_at": "2026-07-30"
    }
  },
  {
    "spelling": "answer",
    "pos": "n.",
    "countability": "countable",
    "number_behavior": "regular",
    "default_number": "singular",
    "semantic_category": "abstract",
    "provenance": {
      "source": "curated_by_agent",
      "reviewed": true,
      "confidence": "high",
      "checked_at": "2026-07-30"
    }
  },
  {
    "spelling": "apple",
    "pos": "n.",
    "countability": "countable",
    "number_behavior": "regular",
    "default_number": "singular",
    "semantic_category": "food",
    "provenance": {
      "source": "curated_by_agent",
      "reviewed": true,
      "confidence": "high",
      "checked_at": "2026-07-30"
    }
  },
  {
    "spelling": "artist",
    "pos": "n.",
    "countability": "countable",
    "number_behavior": "regular",
    "default_number": "singular",
    "semantic_category": "person",
    "provenance": {
      "source": "curated_by_agent",
      "reviewed": true,
      "confidence": "high",
      "checked_at": "2026-07-30"
    }
  },
  {
    "spelling": "aunt",
    "pos": "n.",
    "countability": "countable",
    "number_behavior": "regular",
    "default_number": "singular",
    "semantic_category": "person",
    "provenance": {
      "source": "curated_by_agent",
      "reviewed": true,
      "confidence": "high",
      "checked_at": "2026-07-30"
    }
  },
  {
    "spelling": "baby",
    "pos": "n.",
    "countability": "countable",
    "number_behavior": "regular",
    "default_number": "singular",
    "semantic_category": "person",
    "provenance": {
      "source": "curated_by_agent",
      "reviewed": true,
      "confidence": "high",
      "checked_at": "2026-07-30"
    }
  },
  {
    "spelling": "bag",
    "pos": "n.",
    "countability": "countable",
    "number_behavior": "regular",
    "default_number": "singular",
    "semantic_category": "object",
    "provenance": {
      "source": "curated_by_agent",
      "reviewed": true,
      "confidence": "high",
      "checked_at": "2026-07-30"
    },
    "location_preposition": "in"
  },
  {
    "spelling": "ball",
    "pos": "n.",
    "countability": "countable",
    "number_behavior": "regular",
    "default_number": "singular",
    "semantic_category": "object",
    "provenance": {
      "source": "curated_by_agent",
      "reviewed": true,
      "confidence": "high",
      "checked_at": "2026-07-30"
    }
  },
  {
    "spelling": "banana",
    "pos": "n.",
    "countability": "countable",
    "number_behavior": "regular",
    "default_number": "singular",
    "semantic_category": "food",
    "provenance": {
      "source": "curated_by_agent",
      "reviewed": true,
      "confidence": "high",
      "checked_at": "2026-07-30"
    }
  },
  {
    "spelling": "bathroom",
    "pos": "n.",
    "countability": "countable",
    "number_behavior": "regular",
    "default_number": "singular",
    "semantic_category": "place",
    "provenance": {
      "source": "curated_by_agent",
      "reviewed": true,
      "confidence": "high",
      "checked_at": "2026-07-30"
    },
    "location_preposition": "in"
  },
  {
    "spelling": "beach",
    "pos": "n.",
    "countability": "countable",
    "number_behavior": "regular",
    "default_number": "singular",
    "semantic_category": "place",
    "provenance": {
      "source": "curated_by_agent",
      "reviewed": true,
      "confidence": "high",
      "checked_at": "2026-07-30"
    },
    "location_preposition": "on"
  },
  {
    "spelling": "bean",
    "pos": "n.",
    "countability": "countable",
    "number_behavior": "regular",
    "default_number": "singular",
    "semantic_category": "food",
    "provenance": {
      "source": "curated_by_agent",
      "reviewed": true,
      "confidence": "high",
      "checked_at": "2026-07-30"
    }
  },
  {
    "spelling": "bear",
    "pos": "n.",
    "countability": "countable",
    "number_behavior": "regular",
    "default_number": "singular",
    "semantic_category": "animal",
    "provenance": {
      "source": "curated_by_agent",
      "reviewed": true,
      "confidence": "high",
      "checked_at": "2026-07-30"
    }
  },
  {
    "spelling": "bedroom",
    "pos": "n.",
    "countability": "countable",
    "number_behavior": "regular",
    "default_number": "singular",
    "semantic_category": "place",
    "provenance": {
      "source": "curated_by_agent",
      "reviewed": true,
      "confidence": "high",
      "checked_at": "2026-07-30"
    },
    "location_preposition": "in"
  },
  {
    "spelling": "beef",
    "pos": "n.",
    "countability": "uncountable",
    "number_behavior": "mass",
    "default_number": "singular",
    "indefinite_article_override": "none",
    "verb_agreement": "singular",
    "semantic_category": "food",
    "provenance": {
      "source": "curated_by_agent",
      "reviewed": true,
      "confidence": "high",
      "checked_at": "2026-07-30"
    }
  },
  {
    "spelling": "beer",
    "pos": "n.",
    "countability": "uncountable",
    "number_behavior": "mass",
    "default_number": "singular",
    "indefinite_article_override": "none",
    "verb_agreement": "singular",
    "semantic_category": "drink",
    "provenance": {
      "source": "curated_by_agent",
      "reviewed": true,
      "confidence": "high",
      "checked_at": "2026-07-30"
    }
  },
  {
    "spelling": "bike",
    "pos": "n.",
    "countability": "countable",
    "number_behavior": "regular",
    "default_number": "singular",
    "semantic_category": "object",
    "provenance": {
      "source": "curated_by_agent",
      "reviewed": true,
      "confidence": "high",
      "checked_at": "2026-07-30"
    }
  },
  {
    "spelling": "bird",
    "pos": "n.",
    "countability": "countable",
    "number_behavior": "regular",
    "default_number": "singular",
    "semantic_category": "animal",
    "provenance": {
      "source": "curated_by_agent",
      "reviewed": true,
      "confidence": "high",
      "checked_at": "2026-07-30"
    }
  },
  {
    "spelling": "birthday",
    "pos": "n.",
    "countability": "countable",
    "number_behavior": "regular",
    "default_number": "singular",
    "semantic_category": "time",
    "provenance": {
      "source": "curated_by_agent",
      "reviewed": true,
      "confidence": "high",
      "checked_at": "2026-07-30"
    }
  },
  {
    "spelling": "boat",
    "pos": "n.",
    "countability": "countable",
    "number_behavior": "regular",
    "default_number": "singular",
    "semantic_category": "object",
    "provenance": {
      "source": "curated_by_agent",
      "reviewed": true,
      "confidence": "high",
      "checked_at": "2026-07-30"
    }
  },
  {
    "spelling": "book",
    "pos": "n.",
    "countability": "countable",
    "number_behavior": "regular",
    "default_number": "singular",
    "semantic_category": "object",
    "provenance": {
      "source": "curated_by_agent",
      "reviewed": true,
      "confidence": "high",
      "checked_at": "2026-07-30"
    }
  },
  {
    "spelling": "boss",
    "pos": "n.",
    "countability": "countable",
    "number_behavior": "regular",
    "default_number": "singular",
    "semantic_category": "person",
    "provenance": {
      "source": "curated_by_agent",
      "reviewed": true,
      "confidence": "high",
      "checked_at": "2026-07-30"
    }
  },
  {
    "spelling": "bottle",
    "pos": "n.",
    "countability": "countable",
    "number_behavior": "regular",
    "default_number": "singular",
    "semantic_category": "object",
    "provenance": {
      "source": "curated_by_agent",
      "reviewed": true,
      "confidence": "high",
      "checked_at": "2026-07-30"
    }
  },
  {
    "spelling": "box",
    "pos": "n.",
    "countability": "countable",
    "number_behavior": "regular",
    "default_number": "singular",
    "semantic_category": "object",
    "provenance": {
      "source": "curated_by_agent",
      "reviewed": true,
      "confidence": "high",
      "checked_at": "2026-07-30"
    },
    "location_preposition": "in"
  },
  {
    "spelling": "boy",
    "pos": "n.",
    "countability": "countable",
    "number_behavior": "regular",
    "default_number": "singular",
    "semantic_category": "person",
    "provenance": {
      "source": "curated_by_agent",
      "reviewed": true,
      "confidence": "high",
      "checked_at": "2026-07-30"
    }
  },
  {
    "spelling": "bread",
    "pos": "n.",
    "countability": "uncountable",
    "number_behavior": "mass",
    "default_number": "singular",
    "indefinite_article_override": "none",
    "verb_agreement": "singular",
    "semantic_category": "food",
    "provenance": {
      "source": "curated_by_agent",
      "reviewed": true,
      "confidence": "high",
      "checked_at": "2026-07-30"
    }
  },
  {
    "spelling": "bus",
    "pos": "n.",
    "countability": "countable",
    "number_behavior": "regular",
    "default_number": "singular",
    "semantic_category": "object",
    "provenance": {
      "source": "curated_by_agent",
      "reviewed": true,
      "confidence": "high",
      "checked_at": "2026-07-30"
    }
  },
  {
    "spelling": "butter",
    "pos": "n.",
    "countability": "uncountable",
    "number_behavior": "mass",
    "default_number": "singular",
    "indefinite_article_override": "none",